id,name,updDesc
4656186,شلوار زنانه آگی مدل 23963,"This is a knee-length, tight-fitted trouser made of polyester material with a plain design. It features a small logo on the left thigh and is suitable for casual occasions. The trouser is designed to reach to the ankle and is from a brand based in Turkey."
4666444,شلوار زنانه آر اِن اِس مدل 104126-72,"This is a pair of straight-fitting, ankle-length pants in red, featuring a visible waistband and button. Made of cotton thread material, these pants are plain in pattern and ideal for casual occasions. Both the brand and manufacturing are based in Iran."
4689884,شلوار زنانه بلو موشن مدل 334zd,"This is a red, knee-length, straight-fitting trouser made of cotton thread and polyester. It features a button and belt loops. The trouser is plain in pattern and suitable for party and casual occasions. It is from a brand based in Germany."
4821750,شلوار زنانه اسمارا مدل Es872,"This is a straight-fitting trouser with a length that reaches to the ankle, featuring a blue, white, and black plaid pattern. It is made of a blend of cotton thread, polyester, and elastane materials. The trouser is patterned and suitable for both party and casual occasions. It is from a brand based in Germany."
4901016,شلوار زنانه اسمارا مدل 2023,"This is a pair of dark-colored, straight-fit trousers made of polyester material, featuring a drawstring waist for adjustability and a regular crotch length. The trousers are ideal for casual occasions and are from a brand based in Germany."
522607,ساپورت زنانه آریو شاپ مدل 109,"This is a pair of tight-fitting, high-waisted trousers in black, made of cotton thread material. They are ankle-length and ideal for casual occasions with a high-crotch design."
524789,شلوار زنانه آگی مدل اسپرتیو 23960,"This is a tight-fitting, knee-length, sleeveless trouser in black with a logo on the left thigh, suitable for casual occasions. The material is a cotton blend and has a regular crotch."
5266662,شلوار زنانه اسمارا مدل pol005,"This is a tight-fitting trouser in black, made of a fabric with a plain pattern. It has a length that reaches to the ankle and a regular crotch. The trouser is suitable for formal, casual, and party occasions. It is made from a blend of polyester, cotton thread, and viscose materials. Both the brand and manufacturing are based in Germany."
5493860,شلوار زنانه پپا مدل Flaneur رنگ سفید,"This is a cuffed-fitting, below-the-ankle trouser in white fabric, featuring a buttoned front and an elastic waistband. It is made of fleece material and is suitable for sports occasions. The trouser has a regular crotch and is designed for casual wear."
5493882,شلوار زنانه پپا مدل Flaneur رنگ کاراملی,"This is a cuffed, below-the-ankle trouser in tan, made of fleece material. It has a straight fit and features a drawstring waistband and button closure. The trouser has a plain pattern and is suitable for both sport and casual occasions."
5500092,شلوار زنانه اسمارا مدل 5500092,"This is a pair of women's straight-cut trousers made from polyester fabric, featuring a plain design in pink color. They are suitable for casual and party occasions and have a regular crotch fit with belt loops. The length of the trousers is to the ankle."
5551199,شلوار زنانه کیابی مدل fa553,"This is a straight-fit trouser in black, made of a combination of cotton and cotton thread materials. It features a knee-length design with a plain pattern, a zippered side pocket, and a creased design. The trouser is suitable for casual and party occasions and is from a brand based in France, with manufacturing also in France."
5573594,شلوار زنانه برادوی ان وای سی فشن مدل 10158633,"This is a pair of tight-fitting, above-the-ankle yellow trousers with a button and zip fly closure, belt loops, and a visible back pocket. The trousers are made of natural fibers and are suitable for casual and party occasions. The pattern is plain."
5630344,شلوار زنانه اسمارا مدل 5630344,"This is a straight-fit, ankle-length pair of burgundy trousers made from a blend of elastane, polyester, and linen materials. The trousers are patterned and suitable for casual occasions, as well as sport and party settings. They are from a brand based in Germany."
5718847,سرهمی زنانه اسمارا مدل 5718847,"This is a regular-fitting, short-length black jumpsuit with an elastic waistband and a boat neck. It is sleeveless and made of lyocell material, suitable for casual, sport, and party occasions. The jumpsuit features a plain pattern and is from a brand based in Germany."
5829461,سرهمی زنانه ورو مدا مدل اوورال,"This is a regular-fitting, ankle-length jumpsuit with an animal print pattern in red, black, white, and orange colors. It features an elastic waistband, adjustable straps, and a high-crotch design. The jumpsuit is made of knitted material and is ideal for party occasions. It is manufactured in China."
5880559,شلوار زنانه اچ اند ام مدل 0482458001,"This is a loose-fitting trouser in black and white striped design, reaching to the ankle, with a drawstring and side pockets. It is made of polyester material and suitable for sport occasions. The trouser is from a brand based in Sweden."
5902842,شلوار زنانه اسمارا مدل Z-589,"This trouser is a straight-fit, knee-length garment in navy blue, made of linen material. It features a regular crotch and has a visible brand tag. The trouser is plain and suitable for various occasions including sport, casual, formal, and party wear."
6037784,شلوار زنانه زیبو مدل Anis,"This is a regular-fitting trouser in black, with a hip-length and straight fit above the ankle. It features a drawstring waist and is made of polyester material. The trouser is plain and suitable for both casual and formal occasions. The brand is based in Iran."
6160644,شلوار زنانه ایسوس مدل 7307186,"This is a regular-fitting trouser in pink and gold, made of linen material, featuring a baroque pattern. It has a high-waisted design, a decorative waistband with a large button, and reaches to the ankle. The trouser is patterned and suitable for various occasions including sport, casual, formal, and party. It is manufactured in Turkey."
6364415,سرهمی زنانه ورو مدا مدل Nova,"This is a regular-fitting jumpsuit with a printed floral pattern in black and grey, designed to reach the ankle. It features a boat neck, adjustable straps, and a cinched waist, suitable for casual and party occasions. The jumpsuit has a high-crotch design and is made of natural fibers. It is from a brand based in Denmark."
6462193,سرهمی زنانه مانگو مدل 51033017,"This is a regular-fitting, ankle-length jumpsuit in yellow, featuring a floral pattern. It has a cropped top portion and is sleeveless, made of cotton thread material. The jumpsuit is ideal for various occasions such as sports, casual outings, and parties, and is manufactured in Morocco."
6465055,شلوار زنانه اونلی مدل Onl787,"This is a straight-fitting, ankle-length trouser made of fabric with a printed heart pattern in varying shades of green, featuring a black waistband with belt loops. The trouser is patterned and suitable for various occasions including sport, casual, and party."
6576945,شلوار زنانه گردیه مدل 308139-15,"This is a pair of regular-fit, ankle-length pants in yellow, featuring a structured design and pockets. They are made from Maserati material and have a plain pattern. These pants are ideal for party occasions."
659040,ساق شلواری زنانه نوردای کد 719181بسته 1 عددی,"This is a tight-fitting, ankle-length trouser in black, made of cotton thread material and featuring a plain pattern. It is suitable for casual occasions."
6627207,شلوار زنانه اسمارا مدل FS3434,"This is a pair of regular-fitting, ankle-length trousers in black, made of linen fabric. They feature belt loops and a button, and have a plain pattern. These trousers are suitable for various occasions, including sport, casual, formal, and party settings. The brand is based in Germany."
6627519,شلوار زنانه اسمارا مدل FS9898,"This is a pair of slim fit, ankle-length trousers in black, made from a smooth blend of elastane, polyester, and linen materials. The trousers are plain in pattern and suitable for various occasions including sport, casual, and party. They are from a brand based in Germany."
6629689,شلوار زنانه اسمارا مدل FS9797,"This is a pair of tight-fitting, ankle-length pants in pink, made from a blend of elastane and linen materials with a plain design. The pants are suitable for various occasions including sport, casual, and party. They are from a brand based in Germany."
666597,شلوار زنانه سیاوود مدل COTTON-TR-W-R0188,"This is a pair of tight-fitting, above-the-ankle burgundy pants made from cotton thread material. They are suitable for casual or party occasions. The pants are from a brand based in Iran."
666627,شلوار زنانه سیاوود مدل COTTON-TR-W-G0028,"This is a pair of tight-fitting, ankle-length pants in dark grey, made from cotton thread material. The pants have a regular crotch length and are suitable for casual and party occasions. The brand is based in Iran."
6744796,لگینگ ورزشی زنانه مدل R-4101,"This is a pair of tight-fitting black leggings with a red waistband, reaching down to the ankle. They are made from filament material and have a plain pattern, making them suitable for sporty occasions. The country of manufacturing and the brand country are unknown."
6789722,شلوار زنانه اسمارا مدل Ft312,"This is a tight-fitting, knee-length trouser in black, made of a blend of elastane, polyester, and viscose materials. The trouser features a plain pattern and is high-waisted. It is suitable for casual, formal, and party occasions. The brand is based in Germany."
6821552,شلوار زنانه اسمارا مدل 455,"This is a straight-fitting, ankle-length trouser in pink, made of crepe fabric with a plain pattern. It is suitable for casual, formal, and party occasions. The trouser is from a brand based in Germany."
6838160,شلوار زنانه تالی وایل مدل SPAPEPUMPVHW-HH,"This is a black, skinny-fitting trouser made of polyester velour, featuring a button closure and a high-crotch fit. The trouser has a knee-length design and is ideal for casual occasions. It is a plain pattern garment. The manufacturing and brand country are currently unknown."
6850805,سرهمی زنانه کوبوس مدل 71890,"This is a regular-fitting, ankle-length jumpsuit in black, featuring a sweetheart neckline. It is made of a polyester and elastane blend and is suitable for various occasions including sport, casual, and party. The jumpsuit has a plain pattern and a regular crotch length."
6859608,شاوار زنانه مدل 906 رنگ ذغالی,"This is a tight-fitting trouser in grey color, made of tencel material. It has a knee-length design with a high-crotch, small front pocket, and belt loops at the waistband. The trouser is plain and suitable for various occasions including sport, casual, and party. The brand and manufacturing country are unknown."
6890360,شلوار زنانه اسمارا مدل E4191,"This is a regular-fitting trouser in black, designed to reach the ankle length. It is made of a blend of elastane, polyester, and linen materials, featuring a regular crotch and a plain pattern. The trouser is suitable for various occasions, including sport, casual, formal, and party. It is from a brand based in Germany."
6896994,سرهمی زنانه کیابی مدل MH2119,"This is a regular-fitting, below-the-ankle jumpsuit in black, featuring a lace overlay with floral patterns. It has a sweetheart neckline and no sleeves. The jumpsuit is made from a combination of stretch, elastane, polyester, black chiffon (crepe), lace, and chiffon crepe materials. It is suitable for various occasions including sport, casual, formal, and party."
6908626,شلوار زنانه اسمارا مدل کتان 2021,"This is a regular-fitting trouser in grey, made of cotton fibers. It features a high-crotch design and drawstrings, suitable for casual, sport, and party occasions. The trouser length reaches to the ankle and is from a brand based in Germany, with manufacturing also taking place in Germany. It has a plain pattern."
6955764,سرهمی زنانه اسمارا مدل S2131,"This is a loose-fitting, ankle-length jumpsuit in purple, featuring a heart design on the chest and a hood. It is suitable for various occasions including sport, casual, formal, and party wear. The jumpsuit has long sleeves and a flirtatious neck design, made from a combination of cotton fibers, Prada, and double cotton materials. It is patterned and from a brand based in Germany, with manufacturing also in Germany."
7021660,سرهمی زنانه اسمارا مدل IAN 317204,"This is a regular-fitting, ankle-length jumpsuit in grey and white, featuring a starry moons print. It has long sleeves and a hood, making it suitable for both casual and sleepwear occasions. The jumpsuit is made of polyester material and is patterned. It is from a brand based in Germany."
7111933,سرهمی زنانه اسمارا مدل S2022,"This is a regular-fitting, ankle-length jumpsuit in pink color, made of polyester material. It features a hood with a white lining and long sleeves, designed for casual occasions. The jumpsuit has a folded neck and is plain in pattern. It is manufactured in Germany."
7156716,شلوار زنانه اسمارا مدل Par1548,"This is a loose-fitting, below-the-ankle grey denim trouser featuring a drawstring waist. It is made of linen and viscose material and has a plain pattern. This trouser is suitable for various occasions, including sport, casual, and party wear. The brand is based in Germany."
7156844,شلوار زنانه اسمارا مدل Par1553,"This is a pair of straight-fitting trousers in gray with a checkered pattern, reaching to the ankle. They feature a traditional button closure and are made from a blend of elastane, polyester, and viscose materials. These trousers are suitable for various occasions including sport, casual, formal, and party settings. The brand is based in Germany."
7157763,شلوار زنانه مانگون مدل dfg543,"This is a pair of straight-fit, ankle-length trousers in grey and white, featuring a checkered pattern. The trousers are designed in a straight-leg style, suitable for various occasions including sport, casual, formal, and party. They are made of wool material."
7205368,سرهمی زنانه ورو مدا مدل Olsen,"This is a regular-fitting, ankle-length jumpsuit in black with a sweetheart neckline and a sleeveless design. It features an elastic waistband and a decorative band at the waist. The jumpsuit is made of chiffon crepe material and is suitable for party occasions. It is from a brand based in Denmark and has a plain pattern."
7254565,شلوار زنانه ورو مدا مدل 4242,"This is a regular-fitting trouser in grey made of cotton thread material. It features a plain pattern with two flap pockets, a button on the waistband, and a zipper fly. The trouser length is to the ankle and is suitable for various occasions including sport, casual, and party. It is from a brand based in Denmark and is manufactured in China."
7284627,شلوار زنانه ورومدا مدل 433,"This is a regular-fitting trouser with a checkered pattern featuring black and white checks bordered by a thick line, suitable for various occasions including sport, casual, formal, and party. It has a length that reaches to the ankle and is made of polyester and polyamide materials. The trouser is from a brand based in England."
7329349,شلوار زنانه اسمارا مدل IAN318772_1904,"This is a tight-fitting trouser in red, designed to be ankle-length and suitable for casual and party occasions. It is made of a blend of elastane, polyester, and linen materials. The trouser has a visible tag and is plain in pattern."
7331685,سرهمی زنانه اسمارا مدل 24568,"This is a regular-fitting, above-the-ankle jumpsuit in dark blue, featuring a plaid design with red and white accents. It has long sleeves and a shirt collar, made of cotton thread material. The jumpsuit is checkered and suitable for casual occasions. Both the brand and manufacturing are based in Germany."
7374997,سرهمی زنانه اونلی مدل 48391,"This jumpsuit is a regular-fitting, ankle-length garment in neon yellow and black, featuring decorative buttons on the bodice. It has a boat neck and a sleeveless design, made of polyester material. The jumpsuit is plain in pattern and suitable for both sport and party occasions."
7398715,شلوار زنانه اسمارا مدل شاین کد 7398715,"This is a pair of tight-fitting, ankle-length trousers in black, made from a synthetic blend material of elastane, polyester, and linen. There is no visible pattern. The trousers are suitable for casual and party occasions and are from a brand based in Germany."
7406967,سرهمی زنانه اسمارا مدل 199,"This is a regular-fitting, above-the-ankle black jumpsuit with a zipper detail on the front and a high-crotch design, suitable for casual and party occasions. It is strapless and made in Germany. The jumpsuit is from a brand based in Germany and features a plain pattern."
7438595,شلوار زنانه نکست مدل 4607,"This is a straight-fitted trouser in black, made of a blend of elastane and cotton thread materials. It features a plain pattern and is knee-length, suitable for casual, formal, and party occasions. The trouser has a regular crotch."
7565390,سرهمی زنانه اسمارا مدل Moon & Stars,"This is a regular-fitting, ankle-length grey Fanrip jumpsuit with a star pattern, designed for casual wear. It features a hood and a zip-up front, with long sleeves. Made of polyester material, this jumpsuit is patterned and suitable for various occasions including sport, casual, formal, and party. Both the brand and manufacturing are based in Germany."
7581872,شلوار زنانه لوسیفر مدل A1070-15437,"This is a pair of flared trousers in yellow, featuring a distressed print. The trousers have a below the ankle length and a regular-length crotch. They are made of a cotton and linen blend material and are suitable for sport, casual, and party occasions. The brand and manufacturing countries are unknown."
7691317,شلوار زنانه کیکی رایکی مدل BB03487-055,"This is a pair of loose-fitting, ankle-length trousers with vertical stripes in beige and white colors, suitable for casual and party occasions. They are made of cotton fibers and feature a regular crotch."
7691318,شلوار زنانه کیکی رایکی مدل BB03487-075,"This is a pair of loose-fitting, ankle-length trousers in black with light stripes, suitable for casual and party occasions. They are made of cotton fibers and have a regular crotch. The pattern is striped, and information regarding the brand and manufacturing country is unknown."
7691319,شلوار زنانه کیکی رایکی مدل BB03487-031,"This is a loose-fitting, ankle-length pair of trousers with a classic five-pocket design, featuring black and tan stripes. The fabric is made of cotton fibers and is suitable for casual and party occasions. The country of manufacture is Iran."
7691320,شلوار زنانه کیکی رایکی مدل BB03487-002,"This is a loose-fitting, striped trouser made of cotton fibers, featuring a relaxed flare at the bottom and suitable for casual and party occasions. The trouser extends to the ankle and comes in black and white colors. It is manufactured in Iran."
7691322,شلوار زنانه کیکی رایکی مدل BB03487-151,"This is a loose-fitting, high-waisted trouser made of cotton fibers, featuring a black and white striped pattern. It has a straight fit and reaches to the ankle, suitable for both casual and party occasions. The manufacturing country is Iran."
7799716,سرهمی زنانه اسمارا مدل MLN101,"This is a loose-fitting hooded jumpsuit available in dark blue or grey, featuring white drawstrings and long sleeves. It is made of a polyester and cotton blend and has a length that reaches to the ankle. The jumpsuit is plain and suitable for casual occasions, sports, and parties. Both the brand and manufacturing are based in Germany."
7855696,شلوار زنانه کیکی رایکی مدل BB03504-014,"This is a straight-fit trouser in beige color, made of a cotton blend fabric with polyester and cotton thread. It is knee-length, featuring a regular crotch and visible stitching. The trouser includes a belt with a circular buckle and is suitable for casual occasions as well as parties. Both the brand and manufacturing are based in Iran."
7861820,شلوار زنانه آر اِن اِس مدل 109,"This is a regular-fitting, ankle-length trouser in olive green, made from a blend of micro and cotton thread materials. It features an elastic waistband and two front pockets with flaps, and is ideal for casual occasions. The trouser is plain and from a brand based in Iran."
7891139,سرهمی زنانه اسمارا مدل جین,"This is a tight-fitting denim jumpsuit with a bib front and shoulder straps, featuring a faded blue pattern. It has a short length and is suitable for casual, sport, and party occasions. Made from a blend of elastane, polyester, and cotton, the jumpsuit is patterned and both the brand and manufacturing are based in Germany."
7917395,شلوار زنانه نیزل مدل P018001110080200-110,"This is a pair of mom style, ankle-length trousers in a solid light grey color, made of cotton fibers material. The trousers have a plain design with no visible pattern, making them suitable for casual or business-casual occasions. Both the brand and manufacturing are based in Iran."
7946395,سرهمی زنانه اسمارا مدل Me,"This is a regular-fitting, short-length jumpsuit with a floral pattern in black, yellow, and white colors, featuring a sweetheart neckline and spaghetti straps. It is made of cotton thread material and is suitable for casual and party occasions."
7955928,شلوار زنانه جوتی جینز مدل 7542,"This is a tight-fitting trouser in black, designed to be worn above the ankle, made of a combination of elastane, cotton, and cotton thread materials. It features a studded belt detail and is suitable for casual occasions. The trouser is from a brand based in Australia and has a regular crotch. It has a plain pattern."
7964760,شلوار زنانه برنس مدل ATINA-15,"This is a pair of tight-fitting trousers in mustard yellow, reaching just above the ankle. They have a classic cut and feature a formal belt and buckle. The trousers are made of crepe material and have a plain pattern. They are suitable for casual and party occasions, and both the brand and manufacturing are based in Iran."
7964764,شلوار زنانه برنس مدل ATINA-72,"This is a pair of regular-fitting, ankle-length trousers in a deep maroon color with a belt, designed for casual and party occasions. The trousers are made of crepe material and have a plain pattern. Both the brand and manufacturing are based in Iran."
7971737,سرهمی زنانه جورج مدل 30391,"This is a loose-fitting, below-the-ankle jumpsuit in black, featuring a deep V-neckline and a knotted detail at the waist. It is made of viscose material and is suitable for formal, casual, sport, and party occasions. The jumpsuit is plain and from a brand based in England."
7988243,شلوار زنانه مانگو کد 50148,"This is a flared-fit trouser in black, made of a fabric with a plain pattern, reaching below the ankle in length. It is suitable for various occasions including sport, casual, and party. The trouser is made from a blend of wool and viscose material."
8007189,شلوار زنانه بوهو مدل 076030,"This is a regular-fitting, ankle-length pair of trousers in mustard yellow, made from a smooth polyester fabric. The trousers are suitable for various occasions including sport, casual, formal, and party. They are designed with a plain pattern and are from a brand based in England."
8011719,شلوار زنانه اسمارا مدل 5665432,"This is a regular-fitting trouser in cream color, made of cotton fibers, cotton thread, and linen. It features a drawstring waist with a low-crotch and has a length that reaches to the ankle. The trouser has a plain design and is suitable for sport, casual, and party occasions. The brand and manufacturing countries are unknown."
8041794,سرهمی زنانه اسمارا مدل 8041794,"This is a regular-fitting, ankle-length floral jumpsuit featuring a belted waist and ruffled neckline, suitable for casual and party occasions. It has a sweetheart neckline and a sleeveless design, made of linen and viscose material. The jumpsuit is patterned and is from a brand based in Germany."
8043378,شلوار زنانه جیمو مدل 022685,"This is a regular-fitting, ankle-length trouser in black, made of polyamide and synthetic leather materials. It features a regular crotch and is suitable for various occasions including sport, casual, formal, and parties. The trouser is plain in pattern and is from a brand based in France."
