id,name,updDesc
13350112,شلوار زنانه گردیه مدل 308205 رنگ کرم,"This is a pair of straight-fitting, below-the-ankle trousers made from a smooth crepe fabric in a solid tan or khaki color, suitable for casual and party occasions. The trousers have a high-crotch design and are from a brand based in Iran, with manufacturing also in Iran. The fabric pattern is plain."
13350115,شلوار زنانه گردیه مدل 308200 رنگ سبز,"This is a pair of straight-fitting, ankle-length trousers in green, made from a smooth crepe fabric with a plain color. The trousers have a high-crotch length and are suitable for both casual and party occasions. They are from a brand based in Iran and are also manufactured in Iran."
13350116,شلوار زنانه گردیه مدل 308200 رنگ کرم,"This is a pair of straight-fit, below-the-ankle trousers in tan color, made of crepe material. They feature a high-crotch seam and are ideal for casual and party occasions. Both the brand and manufacturing are based in Iran. The trousers have a plain pattern."
13350117,شلوار زنانه گردیه مدل 308200 رنگ مشکی,"This is a black, high-waisted, below the ankle trouser made of crepe fabric, suitable for casual and party occasions. It has a straight fit and is plain in pattern. The trouser is manufactured in Iran and is from a brand based in Iran."
13350189,شلوار زنانه گردیه مدل 308210 رنگ کرم,"This is a straight-fitting, ankle-length formal trouser in beige, made of crepe material. It has a high waist and flared legs, with a regular crotch. The trouser is plain and suitable for casual and party occasions. Both the brand and manufacturing are based in Iran."
13350233,شلوار زنانه گردیه مدل 308210 رنگ آبی,"This is a straight-fitting, ankle-length formal trouser in blue, made of crepe fabric. It features a high waist and flared legs, and has a plain pattern. The trouser is suitable for casual and party occasions. The brand and manufacturing are based in Iran."
13350385,شلوار زنانه گردیه مدل 308208 رنگ مشکی,"This is a pair of straight-fitting, high-waisted trousers in black, made from cotton thread material with a plain pattern. They reach to the ankle and feature a regular crotch. These trousers are suitable for casual and party occasions and are from a brand based in Iran, with manufacturing also taking place in Iran."
13350417,شلوار زنانه گردیه مدل 308207 رنگ مشکی,"This is a pair of straight-fitted, ankle-length trousers in black, made from cotton thread material. The trousers have a plain pattern and are suitable for casual and party occasions. Both the brand and manufacturing are based in Iran."
13350433,شلوار زنانه گردیه مدل 308207 رنگ کرم,"This trouser is a straight-fit, ankle-length garment in tan color, featuring a high waist and creased front design, suitable for both casual and party occasions. It is made of cotton fibers material and is from a brand based in Iran, with manufacturing also in Iran."
13351066,شلوار زنانه گردیه مدل 308172 رنگ سبز,"This is a pair of straight-fit, ankle-length trousers in dark blue or navy, made from a smooth crepe fabric with a plain design. The trousers are ideal for casual occasions and are manufactured in Iran. Both the brand and manufacturing are based in Iran."
13357845,شلوار زنانه ترسه به نگار مدل راسته کد 58,"This is a high-crotch, black, straight-fit trouser made of cotton lycra material, with a plain pattern and knee-length design. It is suitable for casual, formal, or party occasions. The trouser is from a brand based in Iran and is also manufactured in Iran."
13359755,شلوار زنانه او وی اس مدل 777503,"This is a regular-fitting pair of black trousers that reach to the ankle, suitable for formal, business casual, casual, sport, or party occasions. They have a straight fit and are made of crepe and elastane materials with a plain pattern. The trousers are from a brand based in Italy."
13389192,سرهمی زنانه اسمارا مدل SMB119,"This is a regular-fitting, below-the-ankle navy blue jumpsuit with a standing collar and long sleeves. It features drawstrings at the waist and hood, made from a polyester and linen synthetic blend fabric. The jumpsuit is patterned and suitable for sport, casual, and party occasions. It is manufactured in Germany."
13412227,شلوار زنانه ریس مدل 1036025-01,"This is a loose-fitting, ankle-length trouser in black, made of cotton thread material. It features a pleated front and two visible black buttons, with a high-crotch design. The trouser is plain in pattern and ideal for casual occasions."
13418418,شلوار زنانه هاوین مدل شالدار 315 مازراتی دمپا رنگ آبی,"This is a pair of flared, below-the-ankle trousers in royal blue, suitable for casual, formal, or party occasions. They have a regular crotch length and are made of crepe and Maserati materials. The trousers come in a plain pattern."
13418485,شلوار زنانه هاوین مدل شالدار 315 مازراتی دمپا رنگ نسکافه ای,"This is a pair of flared, mustard yellow trousers made from crepe and Maserati fabric, extending below the ankle. They have a plain pattern and are suitable for casual, formal, or party occasions."
13420574,سرهمی زنانه کوما مدل 99c3,"This is a regular-fitting jumpsuit in black and white floral pattern, with a straight fit and a length that reaches to the ankle. It features short sleeves and a round neckline. The jumpsuit is made of a blend of polyester, cotton thread, and lyocell materials, making it suitable for various occasions including sport, casual, formal, and party. It is from a brand based in Germany."
13437092,شلوار زنانه اس.اولیور مدل 1263078,"This is a loose-fitting trouser in black color that reaches just above the ankle. It is made from a blend of polyester, linen, and cotton thread materials. The trouser features a plain pattern and is suitable for various occasions including sport, casual, formal, and party. It is from a brand based in Germany."
13464782,شلوار زنانه برندس مدل 713C04,"This is a pair of regular-fitting, ankle-length trousers in a muted pink or mauve color, with a plain fabric finish and distinctive buttons at the waist. They are made of crepe material and are ideal for casual occasions."
13464880,شلوار زنانه برندس مدل 713C19,"This is a regular-fitting trouser in light grey, featuring a plain pattern. It has a regular crotch and is designed with button details on the waistband and an elastic waistband. The trouser has visible lining at the waistband and is suitable for casual occasions. It is made of crepe material and comes in a length to the ankle. The brand and manufacturing country are unknown."
13465108,شلوار زنانه برندس مدل 10185C02,"This is a regular-fitting trouser in solid blue, with a length that reaches to the ankle. It features a regular crotch style and is made of crepe material. The trouser is suitable for casual or formal occasions and has a plain pattern. The brand and manufacturing country are unknown."
13526684,شلوار زنانه اسمارا مدل E900,"This is a regular-fitting, knee-length trouser made of polyamide and viscose fabric in blue color, featuring a regular crotch. The trouser is plain and suitable for casual, formal, and party occasions. Both the brand and manufacturing are based in Germany."
13526708,شلوار زنانه اسمارا مدل Fe202,"This is a pair of tight-fitting, ankle-length trousers in black, made of a blend of polyester and linen. They have a regular crotch and are designed for a contemporary style suitable for casual, formal, and party occasions. The trousers are plain and come from a brand based in Germany, with manufacturing also based in Germany."
13532627,شلوار زنانه ترسه به نگار مدل راسته,"This is a straight-fitting trouser with a knee-length design in a grey, black, and white checkered pattern. It is made of wool material and suitable for casual, formal, and party occasions. The trouser has a high-crotch fit and is from a brand based in Iran, with manufacturing also taking place in Iran."
13553788,شلوار زنانه برندس مدل 10185C02,"This is a regular-fitting, ankle-length trouser in navy blue, made of linen material. It features a regular crotch and a buttoned waistband, suitable for casual occasions. The trouser has a plain pattern."
13602178,شلوار زنانه ورو مدا مدل 145099,"This is a tight-fitting, above-the-ankle trouser with a checkered pattern featuring orange accents, suitable for casual, sport, formal, and party occasions. It is made of cotton and elastane material and is from a brand based in Denmark."
1361086,شلوار جین جذب زنانه - اس.اولیور,"This is a pair of knee-length, straight-fit blue pants featuring ripped knees. The pants have a regular crotch and a red tag inside. The material and brand country are unknown."
13694736,شلوار زنانه ژیار مدل مام کمرکش رنگ نسکافه ای,"This is a pair of mom style, above-the-ankle trousers in beige, made of linen material with a plain fabric texture. They are suitable for casual occasions, as well as sport and party usage. Both the brand and manufacturing are based in Iran."
13694860,شلوار زنانه ژیار مدل اسلیم 90 رنگ مشکی,"This is a slim-fitting, above-the-ankle black trouser with a plain pattern, suitable for casual, sports, and party occasions. It is made of sweatshirt material and is manufactured in Iran. The trouser features a low-crotch design and is from a brand based in Iran."
13694916,شلوار زنانه ژیار مدل اسلیم 90,"This is a slim-fit, above-the-ankle trouser in grey suede with a plain pattern. It is made of sweatshirt material and features a low-crotch design. The trouser is suitable for various occasions, including sport, casual, and party settings. Both the brand and manufacturing are based in Iran."
13743356,شلوار زنانه بلو موشن مدل 23,"This is a regular-fitting trouser in black, made of a cotton blend featuring elastane, polyester, and viscose materials. It is knee-length, with a straight fit, regular crotch, and elastic cuffs. The trouser has a drawstring waist, suitable for a casual look, and is ideal for occasions such as sport, casual outings, and parties. Both the brand and manufacturing are based in Germany. The pattern is plain."
13780569,شلوار زنانه شهزاد مدل 108071108,"This trouser is a loose-fitting garment in khaki color, with a high-crotch and wide-leg style. It is made of polyester material and has a length that reaches to the ankle. This trouser is suitable for casual and party occasions and is plain in pattern. The brand and manufacturing country are unknown."
13780570,شلوار زنانه شهزاد مدل 108071107,"This is a mom-style, ankle-length pair of trousers in black, made from a shiny synthetic fabric. The trousers feature a high-crotch design and are plain in pattern. They are suitable for casual and party occasions and are made of polyester material. The brand and manufacturing country are unknown."
13800401,شلوار زنانه اس.اولیور مدل az2150,"This is a pair of dark-colored, straight-fitting trousers with a high-crotch length, made from linen material and featuring a plain pattern. The trousers are suitable for various occasions including casual, formal, and party settings. They are from a brand based in Germany."
13802374,شلوار زنانه دفکتو مدل جلو چاکدار,"This is a tight-fitting, below the ankle trouser in burgundy with a smooth texture and a slight sheen, featuring a central seam down each leg. The trouser is made of polyester material and is suitable for both sport and casual occasions. It is patterned with stripes."
13836763,شلوار زنانه مکس مدل SP20,"This is a tight-fitting trouser in burgundy color, featuring button details on the waistband and falling to the ankle. It is made of a material blend of nylon, viscose, and elastane, and is suitable for party occasions. The trouser has a plain pattern and is from a brand based in Indonesia."
13941686,شلوار زنانه  مدل راسته فیت,"This is a pair of tight-fitting trousers in tan color, made from maserati material. They have a plain pattern and a length that reaches to the ankle, with a regular crotch length. These trousers are suitable for sport, formal occasions, and parties."
13946746,شلوار زنانه  مدل راسته فیت blc,"This is a tight-fitting, ankle-length trouser in black with a high waist and a plain design. It is made of maserati material and suitable for various occasions including sport, formal, and party."
13988341,سرهمی زنانه اسمارا مدل دکمه دار کد 777,"This is a loose-fitting, short olive green jumpsuit with a round neckline and a buttoned front. It features a high-crotch design and is made of a blend of polyester and cotton materials. The jumpsuit is plain and suitable for various occasions including sports, casual outings, and parties."
14008455,شلوار زنانه اسمارا مدل 393336,"This is a regular-fitting trouser in black, made of cotton with a plain pattern and knee-length to the ankle. It is suitable for various occasions including sport, casual, formal, and party. The manufacturing country is unknown."
14012859,شلوار زنانه سرژه مدل 221160 رنگ مشکی,"This is a black, high-waisted, mom style trouser made of jeans material. It features a regular crotch and has a length that reaches to the ankle. The trouser is plain and suitable for casual or party occasions."
14029797,شلوار زنانه سرژه مدل 208352,"This is a straight-fit trouser in beige, with a high-waisted design made of wool and crepe fabric featuring a plain pattern. The trouser length is to the ankle and is suitable for casual, formal, and party occasions."
14030042,شلوار زنانه سرژه مدل 208352  رنگ ذغالی,"This is a pair of straight-fit, ankle-length pants in black, with a regular crotch and a plain texture. Made of crepe material, these pants are suitable for casual and party occasions."
1403018,شلوار جین جذب زنانه - اونلی,"This is a pair of black, tight-fitting pants made from a synthetic blend material, suitable for casual occasions."
14066357,شلوار زنانه اسمارا مدل 113737,"This is a regular-fitting trouser in navy blue, suitable for casual occasions. It has a straight fit with a regular crotch and reaches to the ankle. The trouser features a plain pattern and is made of a blend of elastane, polyester, and cotton materials. It is suitable for various occasions including sport, casual, formal, and party."
14072027,شلوار زنانه  مدل مازراتی بگ دو پیل crm,"This is a pair of baggy, below-the-ankle trousers made from a smooth maserati fabric in a solid light beige or cream color. The trousers feature pleats at the front and a single button closure. They are plain and suitable for various occasions including sport, casual, formal, and party. Both the brand and manufacturing are based in Iran."
14103964,شلوار زنانه  مدل دم پا زیپ مخفی blc,"This is a pair of flared, below-the-ankle black pants made of Maserati material. They are suitable for various occasions including sport, casual, formal, and party. The manufacturing country is Iran."
14128887,شلوار زنانه دکسونری مدل 804001415 راه راه رنگ طوسی روشن,"This is a slim fit, ankle-length trouser in grey, featuring a pinstriped pattern, suitable for formal occasions. It is made of fabric and linen materials. The trouser can be worn for various occasions, including sport, casual, formal, and parties. Both the brand and manufacturing are based in Iran."
14128892,شلوار زنانه دکسونری مدل  804001421 راه راه رنگ طوسی تیره,"This is a tight-fitting trouser with a pinstriped pattern in black and white, featuring two front pockets and a button closure. It has a length that reaches to the ankle and is made of fabric and linen material. The trouser is suitable for various occasions including sport, casual, formal, and party."
14128948,سرهمی زنانه ترسه به نگار مدل کمر کش 4 دکمه کد 193,"This is a loose-fitting, ankle-length jumpsuit with a printed geometric pattern and a glossy finish on the black lines, suitable for casual and party occasions. It features a sleeveless design and is made of cotton fibers material. The jumpsuit is patterned and is from a brand based in Iran, with manufacturing also in Iran."
1416285,لگینگ زنانه اسمارا مدل Capri-88,"This is a black, knee-length, tight-fitting trouser with a low-crotch design and a plain pattern. It is made of cotton thread material and ideal for casual occasions."
14230090,شلوار زنانه  مدل بگ دو پیله MZ-BLC,"This is a baggy, below-the-ankle trouser in black, made of maserati material. It is suitable for various occasions, including sport, casual, formal, and parties. The trouser is from a brand based in Iran and is also manufactured in Iran. The pattern is plain."
14292677,شلوار زنانه اسمارا مدل 371839,"This is a pair of regular-fitting, light-colored trousers made of a linen and cotton thread blend. They feature a striped pattern and reach just above the ankle, making them suitable for casual and party occasions. The trousers are from a brand based in Germany."
14293562,سرهمی زنانه اچ اند ام مدل 0571812001,"This is a regular-fitting black jumpsuit made of polyester, polyamide, and velvet material, featuring a round neckline and sleeveless design. It has a snug fit that reaches down to the ankle and is suitable for casual occasions. The jumpsuit is plain without any distinct pattern. The brand and manufacturing country are unknown."
14333040,شلوار زنانه نیزل مدل 0466-002 رنگ مشکی,"This is a black, formal, straight-fit trouser made of crepe fabric with a plain pattern, reaching below the ankle in length, and having a high-crotch. The trouser is suitable for casual and party occasions, and both the brand and manufacturing are based in Iran."
14336067,شلوار زنانه قرآنی مدل راسته آزاد blc,"This is a loose-fitting, below-the-ankle trouser in black, made of maserati material with a plain pattern. It is suitable for various occasions such as casual, formal, and party. The trouser is manufactured in Iran and is from a brand based in Iran."
14347644,سرهمی زنانه اسمارا مدل MOD- 01-2024,"This is a loose-fitting, ankle-length jumpsuit made from a soft linen and viscose blend fabric in a muted green color. It features a V-neck and is suitable for both casual and party occasions. The jumpsuit has a plain pattern and is manufactured in Germany."
14400185,شلوار زنانه کوما مدل RSH - 40B6,"This is a pair of tight-fitting, below-the-ankle trousers featuring a floral pattern with red flowers on a white background. They are made of elastane and cotton thread materials, suitable for sport, casual, and party occasions. The manufacturing country is Germany."
14412968,سرهمی زنانه کوما مدل RSH - 5976,"This is a straight-fitted, below-the-ankle jumpsuit in black, featuring a round neckline and short sleeves, suitable for sport and party occasions. It is made of a blend of elastane and polyester material and is manufactured in Germany. The jumpsuit has a high-crotch design and is plain in pattern."
14452860,شلوار زنانه اسمارا مدل لیمو,"This is a straight-fitting trouser in yellow, made of cotton material. It has a length that extends below the ankle and features a plain pattern. The trouser is suitable for various occasions including sport, casual, formal, and party wear."
14492578,شلوار زنانه ایزی دو مدل 86059,"This is a loose-fitting, ankle-length trouser with a striped pattern in black and brownish-gray color, featuring two front pockets with flaps. It is made of polyester and viscose material, suitable for formal occasions. The trouser is manufactured in Iran and is from a brand based in Iran."
14492651,شلوار زنانه ایزی دو مدل 86059,"This is a straight-fit, ankle-length trouser in grey, made of a wool blend with orange stripes. It has a high waist and is designed for formal occasions. The trouser is made from a material that combines polyester and viscose, and it is from a brand based in Iran, with manufacturing also taking place in Iran."
14492707,شلوار زنانه ایزی دو مدل 86059,"This is a straight-fitting trouser in black with a striped pattern, designed with a high waist and a length that reaches to the ankle. It is made of polyester and viscose materials, suitable for formal occasions. Both the brand and manufacturing are based in Iran."
14492824,شلوار زنانه ایزی دو مدل 86059,"This is a pair of straight-fit trousers in black and grey striped pattern, with a regular crotch length and a pocket on the front. The trousers have a length that falls below the ankle and are made of a polyester and viscose blend. They are suitable for formal occasions and are from a brand based in Iran, with manufacturing also in Iran."
14493942,سرهمی زنانه اسمارا مدل e-88863,"This is a regular-fitting, ankle-length jumpsuit in black and white, featuring an abstract swirl pattern. It has a round neckline, short sleeves, and a cinched waist, suitable for casual occasions as well as sport and party settings. The jumpsuit is made of a polyester and viscose blend and is from a brand based in Germany."
14494343,سرهمی زنانه اسمارا مدل s-88932,"This is a regular-fitting, short navy blue jumpsuit made of elastane and viscose. It features floral patterns on the neckline and a bow at the waist, making it suitable for various occasions including sport, casual, and party. The jumpsuit is from a brand based in Germany."
14494481,شلوار زنانه اسمارا مدل g-99655,"This is a pair of tight-fitting, ankle-length trousers in a deep maroon or burgundy color, featuring a polka dot pattern on a woven fabric. Made of polyamide and viscose materials, these trousers are suitable for various occasions including sport, casual, formal, and party. The brand is based in Germany."
14510811,سرهمی زنانه السانا مدل تیاناز کد 173508,"This is a regular-fitting, ankle-length jumpsuit in light beige made of linen material, suitable for casual to business casual occasions. It features a v-neck, long sleeves, and a cinched waist, and has a plain pattern. The jumpsuit is designed for use in both casual and business casual settings, and both the brand and manufacturing are based in Iran."
14510903,سرهمی زنانه السانا مدل تیاناز کد 173522,"This is a regular-fitting, ankle-length jumpsuit in light blue, featuring a sweetheart neckline, elastic cuffs at the ankles, and a belt around the waist. It has short sleeves and is made of linen material. The jumpsuit is plain and ideal for casual occasions. Both the brand and manufacturing are based in Iran."
14542113,سرهمی زنانه کاپشی مدل 02,"This is a regular-fitting, short-length jumpsuit in olive green, featuring a plain pattern. It includes short flutter sleeves and is made of polyester material. The jumpsuit has an adjustable tie waist and is suitable for various occasions, including casual, sport, formal, and party."
14576895,شلوار زنانه اس.اولیور مدل RSH - 5989,"This is a slim-fit trouser in black with a plain fabric texture, featuring a drawstring design. It has a length that falls below the ankle and is suitable for various occasions including sport, casual outings, and parties. The trouser is made of a blend of elastane and cotton thread materials. It is manufactured in Germany."
14577886,شلوار زنانه نکست مدل 303940,"This is a pair of straight-fit, ankle-length trousers in olive green, made from a fabric blend of cotton, linen, cotton thread, and viscose. They are suitable for casual wear and can also be worn for sport, formal occasions, and parties. The trousers have a regular crotch and are from a brand based in England, manufactured in Bangladesh. The pattern is plain."
1464377,لگینگ زنانه جی وی جی مدل GVG-CH5,"This is a pair of tight-fitting, ankle-length leggings in black, made from a stretchy fabric that includes polyamide, knitted material, and cotton thread. They feature a ribbed waistband and are suitable for casual and party occasions. The leggings are plain in pattern and manufactured in China."
14662460,شلوار زنانه اسمارا مدل SH536,"This is a regular-fitting trouser in blue, made of lyocell material. It features a plain pattern, an elastic waistband, rolled cuffs, and a regular crotch. The trouser has a design that goes to the ankle and is suitable for various occasions including sport, casual, and party. Both the brand and manufacturing are based in Germany."
14671956,شلوار زنانه گردیه مدل 27055,"This is a pair of loose-fitting, below-the-ankle trousers in black, made of alizeh crepe material. The trousers feature a straight fit and a high crotch. They are plain in pattern and suitable for casual and party occasions. Both the brand and manufacturing are based in Iran."
